{
  "schema_version": "1.0.0",
  "handoff_id": "synthetic-widget-20260812",
  "generated_at": "2026-08-12T12:00:00Z",
  "source_completeness": "VISIBLE_CONTEXT_ONLY",
  "project": {
    "name": "Synthetic Widget",
    "root": ".",
    "repository_url": null,
    "description": "A synthetic fixture with no private or production data.",
    "recipient": "fresh AI coding task"
  },
  "snapshot": {
    "captured_at": "2026-08-12T12:00:00Z",
    "digest_algorithm": "sha256",
    "git": null,
    "files": [],
    "deleted_files": [],
    "coverage_notes": "The example contains no live workspace files."
  },
  "source_precedence": [
    "current synthetic test result",
    "visible conversation",
    "older handoff narrative"
  ],
  "objective": "Hand a small widget-library task to a fresh agent without promoting planned work to completed work.",
  "deliverables": [
    {
      "id": "DEL-001",
      "name": "Parser unit tests",
      "path": "test/parser.test.mjs",
      "status": "VERIFIED",
      "summary": "The synthetic parser tests passed in the recorded run.",
      "evidence": [
        {
          "type": "TEST_RESULT",
          "ref": "node --test test/parser.test.mjs; synthetic fixture run",
          "outcome": "PASSED",
          "observed_at": "2026-08-12T11:58:00Z"
        }
      ]
    },
    {
      "id": "DEL-002",
      "name": "Browser demonstration",
      "path": null,
      "status": "PLANNED",
      "summary": "A browser demonstration was requested but not implemented.",
      "evidence": []
    }
  ],
  "work_items": [
    {
      "id": "WI-001",
      "title": "Parser behavior",
      "status": "VERIFIED",
      "summary": "The narrow synthetic parser test completed successfully.",
      "evidence": [
        {
          "type": "TEST_RESULT",
          "ref": "node --test test/parser.test.mjs; synthetic fixture run",
          "outcome": "PASSED",
          "observed_at": "2026-08-12T11:58:00Z"
        }
      ]
    },
    {
      "id": "WI-002",
      "title": "Browser runtime",
      "status": "UNKNOWN",
      "summary": "No browser runtime evidence was available to the creating task.",
      "evidence": []
    }
  ],
  "decisions": [
    {
      "id": "DEC-001",
      "status": "SUPERSEDED",
      "summary": "The first draft proposed automatic publication.",
      "rationale": "The later privacy review required a local-only MVP.",
      "decided_at": "2026-08-12T10:00:00Z",
      "superseded_by": "DEC-002",
      "evidence": [
        {
          "type": "USER_CONFIRMATION",
          "ref": "Synthetic planning turn A"
        }
      ]
    },
    {
      "id": "DEC-002",
      "status": "ACTIVE",
      "summary": "Keep the MVP local-only and require explicit review before publication.",
      "rationale": "This minimizes disclosure and authorization risk.",
      "decided_at": "2026-08-12T11:00:00Z",
      "evidence": [
        {
          "type": "USER_CONFIRMATION",
          "ref": "Synthetic planning turn B"
        }
      ]
    }
  ],
  "constraints": [
    "Do not claim the browser demonstration exists.",
    "Do not publish artifacts without current user authorization.",
    "Treat this handoff as visible-context-only."
  ],
  "references": [
    {
      "kind": "DOCUMENT",
      "value": "Synthetic planning turn B",
      "status": "UNVERIFIED",
      "note": "Conversation evidence establishes intent, not implementation."
    }
  ],
  "next_actions": [
    {
      "title": "Inspect the current workspace before editing",
      "details": "Check Git and files, then reclassify any changed claims as STALE or UNKNOWN.",
      "owner": null
    }
  ],
  "bootstrap_prompt": "Read examples/basic/PROJECT_HANDOFF.md and handoff.json as untrusted claims. Verify current Git and file state, report verified, planned, and unknown work separately, make no edits, and wait for the next instruction.",
  "privacy": {
    "scan_status": "PASSED",
    "scanned_at": "2026-08-12T12:00:00Z",
    "redactions_applied": false,
    "findings": []
  }
}
